Law Id,State,Title,Text,Enacted Date,Amended Date,Recent?,Sequence Number,Type,Agency,Significant Update Date,Expired Date,Archived Date,Repealed Date,Topic,Technology Categories,Incentive Categories,Regulation Categories,User Categories,References
6287,NC,Alternative Fuel Vehicle (AFV) and Hybrid Electric Vehicle (HEV) Loans,"The [State Employees' Credit Union](https://www.ncsecu.org/) and the
[Local Government Federal Credit Union](https://www.lgfcu.org/) offer
green vehicle loans to purchase qualified new and used fuel-efficient
vehicles. Vehicles with a combined fuel economy rating of at least 28
miles per gallon, according to revised fuel economy ratings posted on
www.fueleconomy.gov, qualify. The loan interest rates are 0.5% lower
than traditional new or used vehicle loan rates.
",,,false,70,Utility/Private Incentives,"",,,2012-10-01 00:00:00 UTC,,"",BIOD|ETH|ELEC|HEV|HY|NG|PHEV|LPG,LOANS,"",FLEET|IND,""
6306,CA,Alternative Fuel Vehicle (AFV) Rebate Program,"The Fueling Alternatives vehicle rebate program is funded by the
California Air Resources Board and provides grants of up to
$5,000 to consumers who purchase or lease eligible zero emission
vehicles (ZEVs), plug-in hybrid electric vehicles, and AFVs
between May 24, 2007, and April 30, 2009. For the purposes of
this program, ZEVs include full function battery electric
vehicles, hydrogen fuel cell vehicles, low-speed or neighborhood
electric vehicles, and zero emission motorcycles.",,,false,10,State Incentives,"",,2009-04-30 00:00:00 UTC,,,"",ELEC|HEV|HY|NG|PHEV,RBATE,"",FLEET|IND,""
6326,IL,Hybrid Electric Vehicle Rebate,"Through the Green Rewards Program, the Illinois State Treasury offers a
\$1,000 rebate for the purchase of a new hybrid or other fuel efficient
vehicle. Participating banks and credit unions agree to accept a
discounted deposit rate from the state for one year in exchange for
providing the \$1,000 rebates to Illinois residents. The original
vehicle purchase date must be on or after July 15, 2007, and rebates are
available for one year. Rebates are available for new compressed natural
gas, hybrid electric, electric, and fuel cell vehicles with less than
7,500 miles. Buyers must receive financing from a participating
financial institution.
",,,false,10,State Hybrid Incentives,"",,2008-10-01 00:00:00 UTC,,,"",ELEC|HEV|HY|NG|PHEV,RBATE,"",FLEET|IND,""
6407,MD,Hybrid Electric Vehicle (HEV) and Electric Vehicle (EV) Tax Credit,"A tax credit is allowed against the excise tax imposed for the purchase
of qualified HEVs and EVs. For qualified EVs, the tax credit may not
exceed \$2,000. For qualified HEVs, the credit may not exceed: a) \$250
if the vehicle battery provides at least 5% but less than 10% of maximum
power available; b) \$500 if the vehicle battery provides at least 10%
but less than 20% of maximum power available; c) \$750 if the vehicle
battery provides at least 20% but less than 30% of maximum power
available; d) \$1,000 if the vehicle battery provides at least 30% of
maximum power available. Additional tax credits of \$125 to \$500 are
available for HEVs equipped with regenerative braking systems that meet
certain requirements, depending on the amount of energy created from
breaking. A qualified EV must meet the definition set forth in the
Internal Revenue Code. A qualified HEV must meet the current vehicle
exhaust standard set under the federal Tier 2 program for passenger
vehicles. (Reference Maryland Statutes Transportation Code 13-815)
",,,false,12,State Incentives,"",,2010-05-20 00:00:00 UTC,,,"",ELEC|HEV|PHEV,TAX,"",FLEET|IND,http://mlis.state.md.us/
6433,TN,High Occupancy Vehicle (HOV) Lane Exemption,"Vehicles that the U.S. Environmental Protection Agency defines as
Inherently Low Emission Vehicles or Low Emission and Energy-Efficient
Vehicles and have gross vehicle weight ratings of 26,000 pounds or less
are permitted use of HOV lanes regardless of the number of occupants.
Such vehicles must display a Tennessee Department of Revenue decal. This
exemption expires September 30, 2019. For more information, see the
Department of Revenue HOV Smart Pass website. (Reference [Tennessee
Code](http://www.lexisnexis.com/hottopics/tncode/) 55-8-188)
",2008-06-20 00:00:00 UTC,,false,25,State Incentives,"",,,2019-10-01 00:00:00 UTC,,"",ELEC|HEV|PHEV,EXEM,"",FLEET|GOV|IND,http://www.lexisnexis.com/hottopics/michie/
6556,TX,Clean Vehicle Replacement Vouchers,"The Texas Commission on Environmental Quality administers the
AirCheckTexas Drive a Clean Machine program, which provides vehicle
replacement assistance for qualified individuals owning vehicles
registered in participating counties. Vouchers in the amount of \$3,500
are available toward the purchase of a hybrid electric, battery
electric, or natural gas vehicle that is up to three model years old.
For more information about participating counties, qualified vehicles,
program requirements, and how to apply in specific areas, see the
[AirCheckTexas Drive a Clean
Machine](http://www.tceq.texas.gov/airquality/mobilesource/vim/driveclean.html)
website. (Reference [Texas
Statutes](http://www.statutes.legis.state.tx.us/), Health and Safety
Code 382.209-382.220)
",2001-09-01 00:00:00 UTC,2011-06-17 00:00:00 UTC,false,54,State Incentives,"",2019-07-01 20:12:25 UTC,,2019-07-01 00:00:00 UTC,,"",ELEC|HEV|NG|PHEV,OTHER|RBATE,"",IND,http://www.statutes.legis.state.tx.us/
6565,HI,Electric Vehicle (EV) and Infrastructure Grants,"The Hawaii Department of Business, Economic Development, and
Tourism (Department) established the Hawaii Transportation Energy
Transformation Grant Fund to provide grants through the EV Ready
Grant Program ( http://hawaii.gov/dbedt/info/energy/evrebatesgrants/grants ) for
the acquisition of EVs, the installation of EV charging
infrastructure, and the development of innovative programs or the
coordination of activities that diversify transportation energy
sources. The Department awarded $2.6 million in grants in 2011.",2009-06-25 00:00:00 UTC,,false,10,State Incentives,"",,,2010-11-01 00:00:00 UTC,,"",ELEC|PHEV,GNT,"",STATION|FLEET|IND,""
6603,LA,Alternative Fuel Vehicle (AFV) Tax Credit,"Louisiana offers a nonrefundable income tax credit for new original
equipment manufacturer AFVs purchased before July 1, 2021. A taxpayer
may take a tax credit of 10% of the cost of the motor vehicle, up to
\$2,500. To qualify for the tax credit, vehicles must have a dedicated
alternative fuel storage and delivery system and be registered in
Louisiana. For the purpose of this incentive, alternative fuels include
natural gas, propane, biofuel, biodiesel, methanol, ethanol, and
electricity. (Reference [Senate
Bill](https://legis.la.gov/legis/home.aspx) 8, 2021, [Louisiana Revised
Statutes](http://www.legis.state.la.us/) 47:6035, and [Louisiana
Administrative Code](http://www.doa.la.gov/Pages/osr/lac/books.aspx)
Title 61, Section 1913)
",2009-07-09 00:00:00 UTC,2013-04-30 00:00:00 UTC,false,20,State Incentives,"",2017-09-11 13:05:02 UTC,2022-01-01 00:00:00 UTC,2022-09-14 00:00:00 UTC,,"",AFTMKTCONV|BIOD|ETH|ELEC|NG|PHEV|LPG,TAX,"",MAN|FLEET|IND,http://www.legis.la.gov/legis/home.aspx|http://www.legis.state.la.us/|http://www.legis.la.gov/legis/home.aspx|http://doa.louisiana.gov/osr/lac/lac.htm|http://www.legis.la.gov/legis/home.aspx
6622,IL,High Occupancy Toll Lane Access,"Phase Two of the [Illinois Tollway Congestion-Relief
Program](https://www.illinoistollway.com/documents/20184/55375/CONGESTION+RELIEF+PROGRAM+-+FINAL+020711.pdf/73eabdf4-df6f-49f8-acc2-1f587430ee41)
includes a Dedicated Green Lanes Plan that will provide access to
qualified hybrid electric vehicles.
",,,false,50,State Incentives,"",,,2012-12-01 00:00:00 UTC,,"",HEV|PHEV,EXEM,"",FLEET|IND,""
8260,WA,Alternative Fuel Vehicle (AFV) Tax Exemption,"New passenger cars, light-duty trucks, and medium-duty passenger
vehicles that are dedicated AFVs are exempt from state motor vehicle
sales and use taxes. Qualified vehicles include vehicles capable of
operating exclusively on natural gas, propane, hydrogen, or electricity,
and plug-in electric vehicles that are capable of being charged by an
external power source and can travel at least 30 miles using only
electricity. Qualified vehicles must meet the California motor vehicle
emissions standards, comply with the rules of the Washington Department
of Ecology, and have a base model price of \$42,500 or less. The sales
tax exemption applies to up to \$32,000 of a vehicle's selling price or
the total amount of lease payments made. If the original lessee
purchased the leased vehicle before the exemptions expire, the exemption
applies the total lease payments made plus the selling price of the
leased vehicle, up to \$32,000.

As of April 2018, the maximum number of qualifying vehicles sold after
June 15, 2015, 7,500, has been reached, and the sales tax exemption
applies to vehicles delivered to their owners by May 31, 2018. A vehicle
purchased or leased before June 1, 2018, is exempt from the use tax
until it is retired or changes hands. For more information, see the
Green Incentives section of Washington Department of Revenue's
[Incentives
Programs](http://dor.wa.gov/content/FindTaxesAndRates/TaxIncentives/IncentivePrograms.aspx)
website. (Reference [Revised Code of
Washington](http://apps.leg.wa.gov/rcw/) 82.08.809 and 82.12.809)
",2005-05-06 00:00:00 UTC,2016-04-18 00:00:00 UTC,false,10,State Incentives,"",2018-05-02 14:09:33 UTC,2018-06-01 00:00:00 UTC,,,"",AFTMKTCONV|ELEC|HY|NG|PHEV|LPG,EXEM|TAX,"",FLEET|IND,http://apps.leg.wa.gov/rcw/
8620,AZ,Electric Vehicle Supply Equipment (EVSE) Incentive - ECOtality,"Through the EV Project, ECOtality offers EVSE at no cost to individuals
in the Phoenix and Tucson metropolitan areas. To be eligible for free
home charging stations, individuals living within the specified areas
must purchase a qualified plug-in electric vehicle (PEV). Individuals
purchasing an eligible PEV should apply at the dealership at the time of
vehicle purchase. The EV Project incentive program will also cover most,
if not all, of the costs of EVSE installation. All participants in the
EV Project incentive program must agree to anonymous data collection
after installation. Additional restrictions may apply.
",,,false,45,Utility/Private Incentives,"",,2013-03-11 00:00:00 UTC,,,"",ELEC|HEV|PHEV,OTHER,"",IND,""
8621,CA,Electric Vehicle Supply Equipment (EVSE) Incentive - ECOtality,"Through the EV Project, ECOtality offers EVSE at no cost to individuals
in the Los Angeles and San Diego metropolitan areas. To be eligible for
free home charging stations, individuals living within the specified
areas must purchase a qualified plug-in electric vehicle (PEV).
Individuals purchasing an eligible PEV should apply at the dealership at
the time of vehicle purchase. The EV Project incentive program will also
cover most, if not all, of the costs of EVSE installation. All
participants in the EV Project incentive program must agree to anonymous
data collection after installation. Additional restrictions may apply.
",,,false,125,Utility/Private Incentives,"",,2013-03-11 00:00:00 UTC,,,"",ELEC|HEV|PHEV,OTHER,"",IND,""
8622,OR,Electric Vehicle Supply Equipment (EVSE) Incentive - ECOtality,"Through the EV Project, ECOtality offers EVSE at no cost to individuals
in the Portland, Eugene, Salem, and Corvallis metropolitan areas. To be
eligible for free home charging stations, individuals living within the
specified areas must purchase a qualified plug-in electric vehicle
(PEV). Individuals purchasing an eligible PEV should apply at the
dealership at the time of vehicle purchase. The EV Project incentive
program will also cover most, if not all, of the costs of EVSE
installation. All participants in the EV Project incentive program must
agree to anonymous data collection after installation. Additional
restrictions may apply.
",,,false,50,Utility/Private Incentives,"",,2013-03-11 00:00:00 UTC,,,"",ELEC|HEV|PHEV,OTHER,"",IND,""
8623,WA,Electric Vehicle Supply Equipment (EVSE) Incentive - ECOtality,"Through the EV Project, ECOtality offers EVSE at no cost to individuals
in the Seattle metropolitan area. To be eligible for free home charging
stations, individuals living within the specified areas must purchase a
qualified plug-in electric vehicle (PEV). Individuals purchasing an
eligible PEV should apply at the dealership at the time of vehicle
purchase. The EV Project incentive program will also cover most, if not
all, of the costs of EVSE installation. All participants in the EV
Project incentive program must agree to anonymous data collection after
installation. Additional restrictions may apply.
",,,false,75,Utility/Private Incentives,"",,2013-03-11 00:00:00 UTC,,,"",ELEC|HEV|PHEV,OTHER,"",IND,""
8624,TN,Electric Vehicle Supply Equipment (EVSE) Incentive - ECOtality,"Through the EV Project, ECOtality offers EVSE at no cost to individuals
in the Nashville, Knoxville, Memphis, and Chattanooga metropolitan
areas. To be eligible for free home charging stations, individuals
living within the specified areas must purchase a qualified plug-in
electric vehicle (PEV). Individuals purchasing an eligible PEV should
apply at the dealership at the time of vehicle purchase. The EV Project
incentive program will also cover most, if not all, of the costs of EVSE
installation. All participants in the EV Project incentive program must
agree to anonymous data collection after installation. Additional
restrictions may apply.
",,,false,40,Utility/Private Incentives,"",,2013-03-11 00:00:00 UTC,,,"",ELEC|HEV|PHEV,OTHER,"",IND,""
8625,TX,Electric Vehicle Supply Equipment (EVSE) Incentive - ECOtality,"Through the EV Project, ECOtality offers EVSE at no cost to individuals
in the Dallas, Fort Worth, and Houston metropolitan areas. To be
eligible for free home charging stations, individuals living within the
specified areas must purchase a qualified plug-in electric vehicle
(PEV). Individuals purchasing an eligible PEV should apply at the
dealership at the time of vehicle purchase. The EV Project incentive
program will also cover most, if not all, of the costs of EVSE
installation. All participants in the EV Project incentive program must
agree to anonymous data collection after installation. Additional
restrictions may apply.
",,,false,70,Utility/Private Incentives,"",,2013-03-11 00:00:00 UTC,,,"",ELEC|HEV|PHEV,OTHER,"",IND,""
8626,DC,Electric Vehicle Supply Equipment (EVSE) Incentive - ECOtality,"Through the EV Project, ECOtality offers EVSE at no cost to individuals
in the District of Columbia metropolitan area. To be eligible for free
home charging stations, individuals living within the specified areas
must purchase a qualified plug-in electric vehicle (PEV). Individuals
purchasing an eligible PEV should apply at the dealership at the time of
vehicle purchase. The EV Project incentive program will also cover most,
if not all, of the costs of EVSE installation. All participants in the
EV Project incentive program must agree to anonymous data collection
after installation. Additional restrictions may apply.
",,,false,30,Utility/Private Incentives,"",,2013-03-11 00:00:00 UTC,,,"",ELEC|HEV|PHEV,OTHER,"",IND,""
8627,VA,Electric Vehicle Supply Equipment (EVSE) Incentive - ECOtality,"Through the EV Project, ECOtality offers EVSE at no cost to individuals
in the Washington, DC metropolitan area. To be eligible for free home
charging stations, individuals living within the specified areas must
purchase a qualified plug-in electric vehicle (PEV). Individuals
purchasing an eligible PEV should apply at the dealership at the time of
vehicle purchase. The EV Project incentive program will also cover most,
if not all, of the costs of EVSE installation. All participants in the
EV Project incentive program must agree to anonymous data collection
after installation. Additional restrictions may apply.
",,,false,15,Utility/Private Incentives,"",,2013-03-11 00:00:00 UTC,,,"",ELEC|HEV|PHEV,OTHER,"",IND,""
8628,MD,Electric Vehicle Supply Equipment (EVSE) Incentive - ECOtality,"Through the EV Project, ECOtality offers EVSE at no cost to individuals
in the Washington, DC metropolitan area. To be eligible for free home
charging stations, individuals living within the specified areas must
purchase a qualified plug-in electric vehicle (PEV). Individuals
purchasing an eligible PEV should apply at the dealership at the time of
vehicle purchase. The EV Project incentive program will also cover most,
if not all, of the costs of EVSE installation. All participants in the
EV Project incentive program must agree to anonymous data collection
after installation. Additional restrictions may apply.
",,,false,45,Utility/Private Incentives,"",,2013-03-11 00:00:00 UTC,,,"",ELEC|HEV|PHEV,OTHER,"",IND,""
8629,WA,Electric Vehicle Supply Equipment (EVSE) Incentive - Coulomb Technologies,"Coulomb Technologies' ChargePoint America ( http://www.chargepointamerica.com/ ) program offers EVSE at no
cost to individuals or entities in the Bellevue and Redmond
metropolitan areas, excluding Seattle. To be eligible for free
home charging stations, individuals living within the specified
areas must purchase a qualified plug-in electric vehicle.
Application information is available on the ChargePoint America
website. In most cases, the EVSE owner will pay for the
installation; some cities, states, and utilities, however, will
provide funding towards installation costs. All participants in
the ChargePoint America program must agree to anonymous data
collection after installation. Additional restrictions may apply.",,,false,70,Utility/Private Incentives,"",,2012-07-01 00:00:00 UTC,,,"",ELEC|HEV|PHEV,OTHER,"",FLEET|OTHER|IND,""
8630,TX,Electric Vehicle Supply Equipment (EVSE) Incentive - Coulomb Technologies,"Coulomb Technologies' ChargePoint America ( http://www.chargepointamerica.com/ ) program offers EVSE at no
cost to individuals or entities in the Austin metropolitan area.
To be eligible for free home charging stations, individuals
living within the specified area must purchase a qualified
plug-in electric vehicle. Application information is available on
the ChargePoint America website. In most cases, installation will
be paid for by the EVSE owner; some cities, states, and
utilities, however, will provide funding towards installation
costs. All participants in the ChargePoint America program must
agree to anonymous data collection after installation. Additional
restrictions may apply.",,,false,65,Utility/Private Incentives,"",,2012-07-01 00:00:00 UTC,,,"",ELEC|HEV|PHEV,OTHER,"",FLEET|OTHER|IND,""
8631,CA,Electric Vehicle Supply Equipment (EVSE) Incentive - Coulomb Technologies,"Coulomb Technologies' ChargePoint America ( http://www.chargepointamerica.com/ ) program offers EVSE at no
cost to individuals or entities in the San Jose, San Francisco
Bay, Sacramento, and Los Angeles metropolitan area. To be
eligible for free home charging stations, individuals living
within the specified areas must purchase a qualified plug-in
electric vehicle. Application information is available on the
ChargePoint America website. In most cases, installation will be
paid for by the EVSE owner; some cities, states, and utilities,
however, will provide funding towards installation costs. All
participants in the ChargePoint America program must agree to
anonymous data collection after installation. Additional
restrictions may apply.",,,false,85,Utility/Private Incentives,"",,2012-07-01 00:00:00 UTC,,,"",ELEC|HEV|PHEV,OTHER,"",FLEET|OTHER|IND,""
8632,MI,Electric Vehicle Supply Equipment (EVSE) Incentive - Coulomb Technologies,"Coulomb Technologies' ChargePoint America ( http://www.chargepointamerica.com/ ) program offers EVSE at no
cost to individuals or entities in southern Michigan. To be
eligible for free home charging stations, individuals living
within the specified areas must purchase a qualified plug-in
electric vehicle. Application information is available on the
ChargePoint America website. In most cases, installation will be
paid for by the EVSE owner; some cities, states, and utilities,
however, will provide funding towards installation costs. All
participants in the ChargePoint America program must agree to
anonymous data collection after installation. Additional
restrictions may apply.",,,false,40,Utility/Private Incentives,"",,2012-07-01 00:00:00 UTC,,,"",ELEC|HEV|PHEV,OTHER,"",FLEET|OTHER|IND,""
8633,NY,Electric Vehicle Supply Equipment (EVSE) Incentive - Coulomb Technologies,"Coulomb Technologies' ChargePoint America ( http://www.chargepointamerica.com/ ) program offers EVSE at no
cost to individuals or entities in the New York City metropolitan
area. To be eligible for free home charging stations, individuals
living within the specified area must purchase a qualified
plug-in electric vehicle. Application information is available on
the ChargePoint America website. In most cases, installation will
be paid for by the EVSE owner; some cities, states, and
utilities, however, will provide funding towards installation
costs. All participants in the ChargePoint America program must
agree to anonymous data collection after installation. Additional
restrictions may apply.",,,false,60,Utility/Private Incentives,"",,2012-07-01 00:00:00 UTC,,,"",ELEC|HEV|PHEV,OTHER,"",FLEET|OTHER|IND,""
8634,FL,Electric Vehicle Supply Equipment (EVSE) Incentive - Coulomb Technologies,"Coulomb Technologies' ChargePoint America ( http://www.chargepointamerica.com/ ) program offers EVSE at no
cost to individuals or entities in the Orlando metropolitan area.
To be eligible for free home charging stations, individuals
living within the specified area must purchase a qualified
plug-in electric vehicle. Application information is available on
the ChargePoint America website. In most cases, installation will
be paid for by the EVSE owner; some cities, states, and
utilities, however, will provide funding towards installation
costs. All participants in the ChargePoint America program must
agree to anonymous data collection after installation. Additional
restrictions may apply.",,,false,45,Utility/Private Incentives,"",,2012-07-01 00:00:00 UTC,,,"",ELEC|HEV|PHEV,OTHER,"",FLEET|OTHER|IND,""
8635,VA,Electric Vehicle Supply Equipment (EVSE) Incentive - Coulomb Technologies,"Coulomb Technologies' ChargePoint America ( http://www.chargepointamerica.com/ ) offers EVSE at no cost to
individuals in the Washington, DC metropolitan area, including
Northern Virginia. To be eligible for free home charging
stations, individuals living within the specified area must
purchase a qualified plug-in electric vehicle. Application
information is available on the ChargePoint America website. In
most cases, installation will be paid for by the EVSE owner; some
cities, states, and utilities, however, will provide funding
towards installation costs. All participants in the ChargePoint
America program must agree to anonymous data collection after
installation. Additional restrictions may apply.",,,false,10,Utility/Private Incentives,"",,2012-07-31 00:00:00 UTC,,,"",ELEC|HEV|PHEV,OTHER,"",FLEET|OTHER|IND,""
8636,MD,Electric Vehicle Supply Equipment (EVSE) Incentive - Coulomb Technologies,"Coulomb Technologies' ChargePoint America ( http://www.chargepointamerica.com/ ) program offers EVSE at no
cost to individuals or entities in the Washington, DC
metropolitan area. To be eligible for free home charging
stations, individuals living within the specified area must
purchase a qualified plug-in electric vehicle. Application
information is available on the ChargePoint America website. In
most cases, installation will be paid for by the EVSE owner; some
cities, states, and utilities, however, will provide funding
towards installation costs. All participants in the ChargePoint
America program must agree to anonymous data collection after
installation. Additional restrictions may apply.",,,false,40,Utility/Private Incentives,"",,2012-07-31 00:00:00 UTC,,,"",ELEC|HEV|PHEV,OTHER,"",FLEET|OTHER|IND,""
8637,DC,Electric Vehicle Supply Equipment (EVSE) Incentive - Coulomb Technologies,"Coulomb Technologies' ChargePoint America ( http://www.chargepointamerica.com/ ) program offers EVSE at no
cost to individuals or entities in the Washington, DC
metropolitan area. To be eligible for free home charging
stations, individuals living within the specified area must
purchase a qualified plug-in electric vehicle. Application
information is available on the ChargePoint America website. In
most cases, installation will be paid for by the EVSE owner; some
cities, states, and utilities, however, will provide funding
towards installation costs. All participants in the ChargePoint
America program must agree to anonymous data collection after
installation. Additional restrictions may apply.",,,false,25,Utility/Private Incentives,"",,2012-07-01 00:00:00 UTC,,,"",ELEC|HEV|PHEV,OTHER,"",FLEET|OTHER|IND,""
