Law Id,State,Title,Text,Enacted Date,Amended Date,Recent?,Sequence Number,Type,Agency,Significant Update Date,Expired Date,Archived Date,Repealed Date,Topic,Technology Categories,Incentive Categories,Regulation Categories,User Categories,References
349,US,Light-Duty Hybrid Electric Vehicle (HEV) and Advanced Lean Burn Vehicle Tax Credit,"A tax credit is available for qualified light-duty HEVs and advanced
lean burn technology vehicles placed into service after December 31,
2005. The Internal Revenue Service (IRS) must first acknowledge the
manufacturers\' certifications of qualified vehicles and credit amounts,
which are determined using a formula that accounts for improved fuel
economy and lifetime fuel savings potential. The credit begins to phase
out in the second quarter following the calendar quarter in which at
least 60,000 of a manufacturer\'s qualifying HEVs and/or lean burn
passenger automobiles and light trucks have been sold. See the [IRS
Qualified Hybrid
Vehicles](http://www.irs.gov/uac/Summary-of-the-Credit-for-Qualified-Hybrid-Vehicles)
and [IRS Qualified Advanced Lean Burn Technology
Vehicles](https://www.irs.gov/pub/irs-news/ir-08-113.pdf) websites for
the current list of qualified vehicles, credits, phase-out schedules,
and required forms. This tax credit expires December 31, 2010.
(Reference 26 [U.S. Code](http://www.gpo.gov/fdsys/) 30B)
",2005-08-08 00:00:00 UTC,2008-08-04 00:00:00 UTC,false,12,Incentives,U.S. Internal Revenue Service,,2010-12-31 00:00:00 UTC,,,"",HEV|PHEV,TAX,"",FLEET|IND,""
394,US,Heavy-Duty Hybrid Electric Vehicle (HEV) Tax Credit,"A tax credit of up to \$18,000 is available for the purchase of
qualified heavy-duty HEVs with a gross vehicle weight rating of more
than 8,500 pounds. Vehicle manufacturers must follow the procedures
published in [Notice
2007-23](http://www.irs.gov/irb/2007-23_IRB/ar08.html) to certify to the
Internal Revenue Service (IRS) that a heavy-duty vehicle meets the
requirements to claim the heavy-duty HEV credit and confirm the amount
of the allowable credit with respect to that vehicle. (Reference 26
[U.S. Code](http://www.gpo.gov/fdsys/) 30B)
",2005-08-08 00:00:00 UTC,,false,12,Incentives,U.S. Internal Revenue Service,,2009-12-31 00:00:00 UTC,,,"",HEV|PHEV,TAX,"",FLEET|IND,""
4177,AZ,Alternative Fuel Vehicle (AFV) and Energy Efficient Plate Programs,"Dedicated AFVs qualify for an AFV special license plate, which are
available from the Arizona Department of Transportation (ADOT).
Recognized alternative fuels are propane, natural gas, electricity, and
hydrogen. There is no limit to the number of AFV license plates ADOT can
issue. For more information, see the ADOT
[AFV](https://azdot.gov/motor-vehicles/vehicle-services/vehicle-registration/alternative-fuel-vehicle)
website.

In addition, certain plug-in hybrid electric vehicles are eligible for
the Energy Efficient license plate from ADOT. ADOT has reached its
maximum limit of 10,000 vehicles and the issuance of Energy Efficient
license plates to new program participants has been suspended until
further notice (verified May 2019). For more information, including how
to apply, see the ADOT [Energy Efficient Plate
Program](https://azdot.gov/motor-vehicles/vehicle-services/plates-and-placards/energy-efficient-plate-program)
website.

(Reference [Arizona Revised
Statutes](http://www.azleg.gov/ArizonaRevisedStatutes.asp) 28-2416 and
28-2416.01)
",2007-01-01 00:00:00 UTC,2009-07-13 00:00:00 UTC,false,15,State Incentives,"",2014-07-29 16:38:47 UTC,,2020-06-12 00:00:00 UTC,,"",ELEC|HY|NG|PHEV|LPG,EXEM,"",FLEET|GOV|IND,http://www.azleg.gov/ArizonaRevisedStatutes.asp
4273,CO,High Occupancy Vehicle (HOV) Lane Exemption,"The Colorado Department of Transportation (CDOT) allows hybrid electric
vehicles that are certified as inherently low emission vehicles (ILEVs)
to travel in HOV and high occupancy toll (HOT) lanes. Qualifying
vehicles must obtain a permit and display an HOV exemption decal and a
toll transponder. CDOT reached its quota of 2,000 permits and will place
new applicants on a waiting list (verified June 2019). For more
information, visit the CDOT Hybrid Vehicle Use in the HOT/HOV Lanes
website. (Reference [Colorado Revised
Statutes](http://www.lexisnexis.com/hottopics/Colorado/) 42-4-1012)
",2008-05-01 00:00:00 UTC,,false,32,State Incentives,"",,,2019-10-01 00:00:00 UTC,,"",HEV|PHEV,EXEM,"",FLEET|GOV|IND,http://www.lexisnexis.com/hottopics/michie/
4286,CT,Alternative Fuel Fueling Infrastructure and Alternative Fuel Vehicle (AFV) Conversion Tax Credit,"Prior to January 1, 2008, a Corporation Business Tax credit is
available for 50% of the following expenditures: the construction
of, improvements to, or equipment for any compressed natural gas
(CNG), liquefied natural gas (LNG), or liquefied petroleum gas
(LPG) refueling station or an electric vehicle recharging
station; or the purchase and installation of equipment used in
dedicated or dual-fuel CNG, LNG, LPG, or electric vehicle
conversions. This credit may be carried forward for up to three
years. (Reference Connecticut General Statutes ( http://www.cga.ct.gov ) 12-217i)",,,false,10,State Incentives,"",,2008-01-01 00:00:00 UTC,,,"",ELEC|NG|PHEV|LPG,TAX,"",STATION|FLEET|IND,""
4368,IL,Alternative Fuel Vehicle (AFV) and Alternative Fuel Rebates,"The Illinois Alternate Fuels Rebate Program provides a rebate for 80%,
up to \$4,000, of the incremental cost of purchasing an AFV; 80%, up to
\$4,000, of the cost of converting a conventional vehicle to an AFV
using a federally certified conversion; and the incremental cost of
purchasing alternative fuels. Eligible fuels for the program include
E85, fuel blends containing at least 20% biodiesel (B20), natural gas,
propane, electricity, and hydrogen. A vehicle may receive one rebate in
its lifetime. Only AFVs purchased from an Illinois-based company or
vendor may qualify, except if the vehicle is a heavy-duty specialty
vehicle that is not sold in Illinois. To qualify for a fuel rebate, the
entity or individual must purchase the majority of E85 or biodiesel fuel
from Illinois retail stations or fuel suppliers. The E85 fuel rebate is
up to \$450 per year (depending on vehicle miles traveled) for up to
three years for each flexible fuel vehicle that uses E85 at least half
the time. The biodiesel fuel rebate (for B20 and higher blends) is for
80% of the incremental cost of the biodiesel fuel, as compared to
conventional diesel. Rebates are part of the Illinois Green Fleets
Program and are available to all qualified Illinois residents,
businesses, government units (except federal government), and
organizations located in Illinois. This program is suspended
indefinitely (verified August 2016). For more information, including a
list of eligible vehicles, see the Illinois Alternate Fuels Rebate
Program. (Reference 415 [Illinois Compiled
Statutes](http://www.ilga.gov/legislation/ilcs/ilcs.asp) 120/30)
",2005-06-20 00:00:00 UTC,2015-03-16 00:00:00 UTC,false,10,State Incentives,"",2015-07-10 17:38:39 UTC,,2017-10-01 00:00:00 UTC,,"",AFTMKTCONV|BIOD|ETH|ELEC|HY|NG|PHEV|LPG,RBATE,"",PURCH|FLEET|IND,""
4446,LA,Alternative Fuel Vehicle (AFV) and Fueling Infrastructure Tax Credit,"The following was repealed by Act ( http://www.legis.state.la.us/ ) No. 469, Section 2, 2009: The state offers an income tax credit
worth 20% of the cost of converting a vehicle to operate on an
alternative fuel, 20% of the incremental cost of purchasing an
Original Equipment Manufacturer (OEM) AFV or hybrid electric
vehicle (HEV), and 20% of the cost of constructing an alternative
fueling station. Only vehicles registered in Louisiana can
receive the tax credit. For the purpose of this incentive,
alternative fuels include compressed natural gas, liquefied
natural gas, liquefied petroleum gas, methanol, ethanol,
electricity, and any other fuels which meet or exceed federal
clean air standards. (Reference Louisiana Revised Statutes ( http://www.legis.state.la.us/ ) 47:38 and 47:287.757)",,,false,10,State Hybrid Incentives,"",,,,2009-07-09 00:00:00 UTC,"",ETH|ELEC|HEV|HY|NG|PHEV|LPG,TAX,"",STATION|FLEET|IND,http://www.legis.state.la.us/
4547,MT,Alternative Fuel Vehicle (AFV) Conversion Tax Credit,"Businesses and individuals are eligible for an income tax credit of up
to 50% of the equipment and labor costs for converting vehicles to
operate using alternative fuels. Qualified alternative fuels include
natural gas, propane, hydrogen, electricity, and fuels containing at
least 85% ethanol, methanol, ether, or another alcohol. The maximum
credit is \$500 for the conversion of vehicles with a gross vehicle
weight rating (GVWR) of 10,000 pounds (lbs.) or less and \$1,000 for
vehicles with a GVWR of more than 10,000 lbs. The credit is only
available for the year the business or individual converts the vehicle.
An alternative fuel seller may not receive a credit for converting its
own vehicles to operate on the alternative fuel it sells. (Reference
[Montana Code Annotated](https://leg.mt.gov/bills/mca/index.html)
15-30-2320)
",,,false,7,State Incentives,"",,,,2022-01-01 00:00:00 UTC,"",AFTMKTCONV|BIOD|ETH|ELEC|HY|NG|PHEV|LPG,TAX,"",MAN|FLEET|IND,https://leg.mt.gov/bills/mca/index.html
4629,NY,Alternative Fuel Vehicle (AFV) Tax Exemption,"New York provides a partial sales and use tax exemption for the
incremental cost of new AFVs and for vehicles that are converted
to run on alternative fuels. This exemption is effective through
October 1, 2006. (Reference New York Tax Law ( http://public.leginfo.state.ny.us/menugetf.cgi ) Article 28,
Section 1115)",,,false,70,Laws and Regulations,"",,2006-09-01 00:00:00 UTC,,,"",ETH|ELEC|HY|NG|PHEV|LPG,EXEM|TAX,FUEL,FLEET|IND,""
4667,OK,Alternative Fuel Vehicle (AFV) Tax Credit,"Prior to January 1, 2009, Oklahoma provides a one-time income tax
credit for 50% of the cost of converting a vehicle to operate on
an alternative fuel, or for 50% of the incremental cost of a new
OEM AFV. The state also provides a tax credit for 10% of the
total vehicle cost, up to $1,500, when an AFV is resold, as long
as a tax credit has not been previously taken on the vehicle.
Additionally, the state provides a tax credit for up to 50% of
the cost of installing refueling infrastructure for AFVs. These
tax credits may be carried forward for up to three years. The
alternative fuels eligible for the credit include compressed
natural gas (CNG), liquefied natural gas (LNG), liquefied
petroleum gas (LPG), ethanol, methanol, and electricity. This tax
credit extends to low-speed electric vehicles as defined by NHTSA
in 49 C.F.R. 571.500 and to forklifts and other similar
self-propelled vehicles. (Reference Oklahoma Statutes ( http://www.lsb.state.ok.us/ ) Section 68-2357.22)",,,false,15,State Incentives,"",,2009-01-01 00:00:00 UTC,,,"",ETH|ELEC|NG|PHEV|LPG,TAX,"",STATION|FLEET|IND,""
4703,PA,Alternative Fuel Vehicle (AFV) Rebates,"The Greater Philadelphia Clean Cities Program (GPCCP) has
Congestion Mitigation Air Quality (CMAQ) funding available for
AFV rebates. The Clean Fueled Fleets Grant is designed to offer
up to 72% of the incremental cost of purchasing AFVs. Up to
$4,000 is available for light duty AFVs, up to $7,000 is
available for medium duty AFVs, and up to $10,000 is available
for heavy duty AFVs. Additionally, some of GPCCP's rebates also
cover the costs of installing and purchasing AFV refueling
stations. To qualify for these rebates, applicants must become
members of the GPCCP and complete and sign an application,
agreeing to certain terms and conditions, such as monitoring fuel
use.",,,false,20,State Incentives,"",,2005-11-01 00:00:00 UTC,,,"",BIOD|ETH|ELEC|HY|NG|PHEV|LPG,RBATE,"",STATION|FLEET|IND,""
4758,UT,Alternative Fuel and Fuel-Efficient Vehicle Tax Credit,"Through 2016, new electric, natural gas, and propane vehicles registered
in Utah are eligible for an income tax credit of 35% of the vehicle
purchase price, up to \$1,500. Plug-in hybrid electric vehicles (PHEVs)
will be eligible for a tax credit of \$1,000. Leased electric, natural
gas, and propane vehicles are eligible for a tax credit on a prorated
basis up to \$1,500. Leased plug-in hybrid electric vehicles will be
eligible for a prorated tax credit up to \$1,000. For additional
information, including eligible vehicles and restrictions, see the Clean
Fuel Vehicle Tax Credit website. (Reference [House
Bill](http://le.utah.gov/) 87, 2016, and [Utah
Code](http://le.utah.gov/xcode/code.html) 19-1-406, 59-7-605, and
59-10-1009)
",,2016-03-29 00:00:00 UTC,false,10,State Incentives,"",2016-04-11 21:15:32 UTC,2016-12-31 00:00:00 UTC,,,"",AFTMKTCONV|ELEC|EFFEC|NG|PHEV|LPG,TAX,"",FLEET|IND,http://le.utah.gov/xcode/code.html|http://le.utah.gov/
4759,UT,Alternative Fuel Vehicle and Fueling Infrastructure Grants and Loans,"The Utah Clean Fuels and Vehicle Technology Grant and Loan Program,
funded through the Clean Fuels and Vehicle Technology Fund, provides
grants and loans to assist businesses and government entities to
include:

-   Up to 50% of the incremental cost of purchasing original equipment
    manufactured clean fuel vehicles,
-   Up to 50% of the cost of converting vehicles to a cleaner burning
    fuel, and
-   The cost of fueling equipment for public/private sector business and
    government vehicles (grants require federal and non-federal matching
    funds).

This program does not support E85 or biodiesel projects. For the purpose
of this program, clean fuels include propane, compressed natural gas,
and electricity. For more information, see the [Utah Clean Fuels
Program](https://air.utah.gov/altfuel/index.php) website.

(Reference [Utah Code](http://le.utah.gov/xcode/code.html) 19-1-401
through 19-1-405)
",,2016-03-29 00:00:00 UTC,false,15,State Incentives,"",2016-04-11 21:20:27 UTC,,2019-02-01 00:00:00 UTC,,"",ELEC|HY|NG|PHEV|LPG,GNT|LOANS,"",STATION|FLEET|IND,http://le.utah.gov/xcode/code.html
4813,WV,Alternative Fuel Vehicle (AFV) Tax Credit,"The state of West Virginia offers a tax credit for the
incremental cost of purchasing an Original Equipment Manufacturer
AFV, or for the cost of converting a vehicle to operate on an
alternative fuel. The tax credit became effective on July 1,
1997, for either personal or corporate income tax. The maximum
credit depends on the vehicle type and Gross Vehicle Weight
Rating (GVWR), as shown below, and cannot exceed the incremental
or conversion cost. Eligible alternative fuels include compressed
natural gas (CNG), liquefied natural gas, liquefied petroleum
gas, blends of 85% or more of methanol and ethanol, other
alcohols, alcohol-derived liquids, and electricity. The credit is
taken in three equal increments over three years and expires June
30, 2006.

GVWR/Vehicle Type
Non-Electric
Vehicle Tax Credit
Electric Vehicle
Tax Credit

10,000 pounds (lbs.) or less
$3,750
$4,125

10,000 to 26,000 lbs.
$9,250
$10,175

Trucks or vans over 26,000 lbs.
$50,000
$55,000

Buses seating over 20 adults
$50,000
$55,000

(Reference West Virginia Code ( http://www.legis.state.wv.us/WVCODE/masterfrm3Banner.cfm ) 11-6D)",,,false,10,State Incentives,"",,2006-06-30 00:00:00 UTC,,,"",ETH|ELEC|NG|PHEV|LPG,TAX,"",FLEET|IND,""
5092,CT,Alternative Fuel Vehicle (AFV) Tax Credit,"Prior to January 1, 2008, a Corporation Business Tax credit is
available for 10% of the incremental cost of purchasing a new
dedicated compressed natural gas, liquefied natural gas,
liquefied petroleum gas, or electric vehicle. This credit may be
carried forward for up to three years. (Reference Connecticut
General Statutes ( http://www.cga.ct.gov ) 12-217i)",,,false,15,State Incentives,"",,2008-01-01 00:00:00 UTC,,,"",ELEC|NG|PHEV|LPG,TAX,"",FLEET|IND,""
5163,UT,High Occupancy Vehicle (HOV) Lane Exemption,"Vehicles with clean fuel license plates are authorized to travel in HOV
lanes regardless of the number of occupants, to the extent authorized or
permitted by federal law or federal regulation. The clean fuel plate
must be purchased from a Utah Motor Vehicles office for a fee of \$15.
Vehicle owners must first obtain a C Plate permit from the Utah
Department of Transportation. To be eligible for a clean fuel license
plate, a vehicle must meet the definition of a clean fuel vehicle as
defined in Utah Code 59-13-102. (Reference [Utah
Code](https://le.utah.gov/xcode/code.html) 41-1a-418, 41-1a-1211,
41-6a-702 and 59-13-102)
",,2008-03-17 00:00:00 UTC,false,20,State Incentives,"",,2010-12-31 00:00:00 UTC,,,"",ELEC|HY|NG|PHEV|LPG,EXEM,"",FLEET|IND,http://le.utah.gov/~code/code.htm
5180,GA,Zero Emission Vehicle (ZEV) Tax Credit,"An income tax credit is available to individuals who purchase or lease a
new ZEV. The amount of the tax credit is 20% of the vehicle cost, up to
\$5,000. For the purpose of this credit, a ZEV is defined as a motor
vehicle that has zero tailpipe and evaporative emissions, including a
pure electric vehicle. Low-speed vehicles do not qualify for this
credit. Any portion of the credit not used in the year the ZEV is
purchased or leased may be carried over for up to five years. The tax
credit expires July 1, 2015. For more information, see the Georgia
Department of Natural Resources Alternative Fuels and Tax Credits
website. (Reference [House
Bill](http://www.legis.ga.gov/en-US/default.aspx) 170, 2015, and
[Georgia Code](http://www.legis.ga.gov/en-US/default.aspx) 48-7-40.16)
",,2015-05-04 00:00:00 UTC,false,15,State Incentives,"",2015-10-15 22:21:08 UTC,2015-07-01 00:00:00 UTC,,,"",ELEC|PHEV,TAX,"",FLEET|IND,http://www.legis.ga.gov/en-US/default.aspx|http://www.legis.ga.gov/en-US/default.aspx
5199,IN,Alternative Fuel Vehicle (AFV) Grants,"The Office of the Lieutenant Governor, Energy Group administers
the AFV Grant Program for projects that involve the purchase of
AFVs, conversion of conventionally fueled vehicles to operate on
alternative fuels, installation of AFV refueling facilities,
purchase and use of renewable transportation fuels, or
combinations of these purposes. AFVs include vehicles capable of
operating on electricity, ethanol, propane, hydrogen and natural
gas, as defined by the Energy Policy Act of 1992 (EPAct). They do
not include hybrid electric vehicles. Grant amounts range from
$2,000 to $50,000 and are determined according to the following
formulas:

* For the purchase of OEM AFVs for which the manufacturer
produces a conventionally fueled equivalent, 80% of the
incremental cost is eligible for funding.
* For the purchase of OEM AFVs for which the manufacturer does
not produce a conventionally fueled equivalent, 30% of the
overall cost of the vehicle is eligible for funding.
* For the conversion of vehicles to run on an alternative fuel,
80% of the cost of conversion is eligible for funding.
* For the purchase and installation of refueling facilities for
an alternative fuel to be used in vehicles, 50% of the facility
cost is eligible for funding.
* For the purchase and use of E85 or biodiesel in blends of 20%
or higher, 50% of the incremental cost is eligible for funding.

Project budgets may include funding from third party sources, but
the applicant itself must directly contribute at least 20% of the
project's total budget. If a grant is awarded, the applicant
will receive funds on a reimbursement basis only. Businesses,
non-profit institutions and units of local government (including
public school systems) are eligible to apply. AFV grants will
not be awarded to fund research projects. Entities that are
required to purchase alternative fuel vehicles under the Energy
Policy Act of 1992 are not eligible for grants under this
program.",,,false,10,State Incentives,"",,2006-03-31 00:00:00 UTC,,,"",BIOD|ETH|ELEC|HY|NG|PHEV|LPG,GNT,"",STATION|PURCH|FLEET|IND,""
5208,DC,Alternative Fuel Vehicle (AFV) Incentives,"The Clean Fuel Fleet Program included an initiative for the
District of Columbia (D.C.) to develop alternative fuel vehicle
(AFV) incentives, such as income tax credits for AFVs, motor fuel
exemptions, and preferential parking. However, the D.C. Council
has not implemented the measure.",,,false,20,State Incentives,"",,2006-09-01 00:00:00 UTC,,,"",BIOD|ETH|ELEC|HY|NG|PHEV|LPG,EXEM|TAX,"",STATION|FLEET|IND,""
